sub-id,movie_name,movie_num,scene,text
sub-07,cartoon_intro_2,11,11000,"Ok, so I guess I’ll start by saying that there were two lobby clips, just because I know you record those, and I did remember them."
sub-07,cartoon_intro_2,11,"1, 107","So it says, “Let’s all go to the lobby and get some snacks,” and it’s all pink, and there's boxes that are dancing, and so on."
sub-07,bus_stop,10,10000,"Ok, so the last clip was the bus stop."
sub-07,bus_stop,10,182,"It begins with a guy standing at the bus stop, wearing white headphones and a red t-shirt."
sub-07,bus_stop,10,182,"And he has a bag with strawberry ice cream that’s slowly melting, because it’s really hot, and he has sweat stains on his shirt."
sub-07,bus_stop,10,183,"Then this car drives in, it’s an SUV."
sub-07,bus_stop,10,183,"And a woman pulls up to the curb, and she gets out, leaves her car door open."
sub-07,bus_stop,10,"183, 184",And then she walks to the phone booth and makes a call.
sub-07,bus_stop,10,185,And I’m pretty sure her car starts to slowly slide down the street while she’s doing that.
sub-07,bus_stop,10,185,"In any case, she starts to walk towards the guy."
sub-07,bus_stop,10,186,She needs to use his phone.
sub-07,bus_stop,10,184,"I guess she couldn’t get through on the payphone or something, or she didn’t have money."
sub-07,bus_stop,10,186,"But she walks towards the guy and she asks him if she could use his phone and not to worry, that she's not going to steal it."
sub-07,bus_stop,10,186,So he gives her the phone.
sub-07,bus_stop,10,187,"She gets on the phone, she makes a call."
sub-07,bus_stop,10,188,"Then she starts saying like, “Where is she? I’m gonna call the police. Where are you?”"
sub-07,bus_stop,10,189,And then she’s like obviously kind of frantic and upset.
sub-07,bus_stop,10,189,Then she throws the phone down on the ground.
sub-07,bus_stop,10,190,"The guy in the red t-shirt goes and picks it up and says, “Hey, this is a $60 phone, lady. Are you gonna pay me back for it?”"
sub-07,bus_stop,10,192,And then further down the road this car pulls up.
sub-07,bus_stop,10,195,"And this guy comes out who’s wearing like part of a tux but without the jacket, so just the black pants and like suspenders and a white shirt."
sub-07,bus_stop,10,194,"The lady goes to him, and the guy with the red shirt is kinda walking behind her."
sub-07,bus_stop,10,197,"And the lady is saying, “ Where is she? Where is she?”"
sub-07,bus_stop,10,197,"And the guy who came out of the car is like, “Who’s this other guy?”"
sub-07,bus_stop,10,198,"And the lady says, “Just a friend,” and the guy’s like, “What?"
sub-07,bus_stop,10,198,"She's not my friend, she just borrowed my phone."
sub-07,bus_stop,10,198,I wanted to see if I could get some money for it.”
sub-07,bus_stop,10,197,"Anyways, the, the guy who came out of the car and the woman start having this exchange."
sub-07,bus_stop,10,198,"And the guy who came out of the car says to the red-shirted guy, “Do you know who I am?”"
sub-07,bus_stop,10,199,"And then he pauses for a second, and he's like, “Oh, you're the Great Aldino, and you're his assistant, like you guys are on TV.”"
sub-07,bus_stop,10,200,"And then the, the woman kinda goes nuts and she pulls out a gun, and then the magician guy says, “Oh, well I have one too, like is yours loaded?” that kind of thing."
sub-07,bus_stop,10,204,And then eventually the woman goes to the car.
sub-07,bus_stop,10,205,"She opens the trunk to, or she tries to open the trunk to look inside."
sub-07,bus_stop,10,206,"And the man with the red shirt now is with the magician, and the magician tells him to pay attention, and he pulls out this thing to hypnotize him."
sub-07,bus_stop,10,206,It’s this box with like a cross on it with some type of bone thing inside.
sub-07,bus_stop,10,206,And so he starts chanting to hypnotize the guy in the red shirt.
sub-07,bus_stop,10,207,And meanwhile the woman has managed to open the trunk and sees something inside.
sub-07,bus_stop,10,208,And the magician has hypnotized the guy who drops his bag with the ice cream in it which is all melted.
sub-07,bus_stop,10,"208, 209","It goes all over the ground, and the guy drops on the ground and starts like pawing and twitching as if he’s a dog that’s asleep."
sub-07,bus_stop,10,"210, 211","And the woman comes around from the car, and the magician is like, “Oh, crap,” because he probably said the wrong words when he was trying to hypnotize the guy."
sub-07,bus_stop,10,210,And so he's like reading over what he should have said.
sub-07,bus_stop,10,"211, 212","And the woman shoots him, and he shoots the woman, and they both fall to the ground."
sub-07,bus_stop,10,213,"And now the guy with the red shirt is acting like a dog, and licking the ice cream on the ground and starts barking and like sniffing around."
sub-07,bus_stop,10,"213, 214","And then as he’s barking he starts hearing somebody else bark in return, or like some, somebody, some dog."
sub-07,bus_stop,10,214,"Anyways he starts crawling, and then this girl comes, also a dog now, obviously hypnotized by the magician."
sub-07,bus_stop,10,215,"And they start sniffing each other, as dogs do."
sub-07,bus_stop,10,216,And then they go off down the street. Ok.
sub-07,post_it_love,9,9000,The clip before that was Post-It Love.
sub-07,post_it_love,9,"167, 168",It starts with these two people who are making photocopies side-by-side in an office building.
sub-07,post_it_love,9,169,"And then they like both look up over the partitions that are slightly like lower than their heads, and look over at each other."
sub-07,post_it_love,9,170,"And then the, the, they all go off to their respective desks."
sub-07,post_it_love,9,"170, 171","The first one the guy goes, and he sits down at his desk, and he opens a file, a file folder, and sees something inside"
sub-07,post_it_love,9,9000,"which I didn’t note because I was distracted ‘cause the volume was loud, and then I asked Janice to turn down the volume."
sub-07,post_it_love,9,174,"The next time I kinda tuned in was when the woman was at her, going to her desk and then she like opened the curtains or the blinds and saw this flower that was made of post-it notes on her window."
sub-07,post_it_love,9,175,"And then the next kind of short part is the guy, who’s now in the bathroom, adjusting his tie."
sub-07,post_it_love,9,175,"Somebody goes into a stall, closes the stall door, and on the stall door is, I think, a purple heart or something else made of post-its."
sub-07,post_it_love,9,-1,And then there's another one that I’m not quite remembering.
sub-07,post_it_love,9,176,"Oh, the woman goes into like this, kinda closet like storage closet, opens the door, turns on the light and sees something else made of post-its that I’m not quite remembering."
sub-07,post_it_love,9,177,And the last scene she's like carrying away this armload of post-it notes in all different colors.
sub-07,post_it_love,9,178,"And she's walking towards like the main area of the offices, and she looks, and there's this massive portrait of two people’s faces made completely out of post-it notes that takes up the entire wall."
sub-07,post_it_love,9,178,And the guy is there adding a few final post-it touches.
sub-07,post_it_love,9,179,And then they look at each other and smile.
sub-07,the_black_hole,8,8000,The one before that is The Black Hole.
sub-07,the_black_hole,8,155,It also starts with a guy who is making photocopies and drinking coffee.
sub-07,the_black_hole,8,"155, 156","And the machine gets stuck or something, and then it produces a sheet of paper that has a large black hole on it."
sub-07,the_black_hole,8,156,"The guy takes it, looks at it, puts it down, continues trying to make photocopies and drink his coffee."
sub-07,the_black_hole,8,157,"Then he puts the cup on top of the, the black hole, and it disappears, and he's like, “Oh.”"
sub-07,the_black_hole,8,158,"Then he pushes his hand like in, through the paper with the black hole, reaches in, pulls his coffee cup back out."
sub-07,the_black_hole,8,158,"And so he’s probably thinking, “Oh, this is kinda cool. I’ll, I wanna see what else I can do with it.”"
sub-07,the_black_hole,8,160,"So he looks around, sees a vending machine and takes the sheet of paper with the black hole, moves towards the vending machine, puts it over the glass and reaches in and grabs a candy bar."
sub-07,the_black_hole,8,"160, 161","Then he opens the candy bar, starts eating it, looks around at what else he can use this black hole for, and he sees this door that’s locked, and apparently contains a safe."
sub-07,the_black_hole,8,161,"So he puts the black hole on top of the door, the, the wooden door, reaches through, unlocks it."
sub-07,the_black_hole,8,"161, 162","Then opens the door, goes through, and there's this small gray safe that’s at the bottom of the, like on the floor."
sub-07,the_black_hole,8,162,And then he takes the sheet with the black hole and puts it on top of the safe.
sub-07,the_black_hole,8,162,"And it, at some point he must’ve gotten a piece of tape and I didn’t notice but the sheet of paper stays there, taped to the safe."
sub-07,the_black_hole,8,162,"And he reaches his hand through, through into the safe and starts pulling out wads of cash."
sub-07,the_black_hole,8,162,"And he pulls out more and more and more, puts them down on the floor."
sub-07,the_black_hole,8,162,"He's getting kinda greedy, looks around seeing if anybody sees him."
sub-07,the_black_hole,8,162,"Nobody’s coming, so he pulls out more and more and more money."
sub-07,the_black_hole,8,162,"And then he's kind of reaching the end of the safe there, but he wants to see if he can get out just a little bit more."
sub-07,the_black_hole,8,163,So he starts to reach in further and further and actually goes into the safe.
sub-07,the_black_hole,8,163,"And as he does so, his pants or his shirt catches the tape that he used to put the black hole on the safe."
sub-07,the_black_hole,8,164,"And the, the sheet with the black hole comes down, and he's in the safe."
sub-07,the_black_hole,8,164,"And now he's trapped in there, pounding on the door, and nobody comes to save him."
sub-07,the_prisoner,7,7000,The one before that is The Prisoner.
sub-07,the_prisoner,7,138,"It starts off with this guy, who’s in like this quirky little village."
sub-07,the_prisoner,7,138,And he is like at a cafe outside with these little tables.
sub-07,the_prisoner,7,138,And a woman comes.
sub-07,the_prisoner,7,138,And I forget the exact exchange they have at the beginning.
sub-07,the_prisoner,7,139,"But he asks, I don’t remember exactly what he asks her, but eventually I think he asks her about a phone."
sub-07,the_prisoner,7,140,"And so she tells him where the phone is, and he goes to, to make a phone call."
sub-07,the_prisoner,7,141,"And when he goes to make a phone call, they ask him like what’s his number."
sub-07,the_prisoner,7,141,"He doesn’t know what they're talking about, and he says like, “I don’t have a number,” and they say, “No number, no phone call.”"
sub-07,the_prisoner,7,142,"And so he's obviously confused, he doesn’t know where he is really, and so he's walking around looking kind of puzzled."
sub-07,the_prisoner,7,144,And then this woman pulls up in like this golf cart.
sub-07,the_prisoner,7,143,"Oh no wait, before that he went to this little thing that has like different numbers pinned up with different keys that he could push and different descriptions as to what the numbers could bring."
sub-07,the_prisoner,7,"143, 144","And he's looking at that, and he pushes one of the numbers, and when he, when he does that, a woman pulls up in a golf cart."
sub-07,the_prisoner,7,"144, 145","And then he gets into the golf cart with her, and they start driving around."
sub-07,the_prisoner,7,144,"And she asks him like where he wants to go, and I think he says France or something, and then she says like, “No, that’s international, we can't do that.”"
sub-07,the_prisoner,7,145,"And they have some kind of discussion at some point, I missed some of the words, but something about people like Czechs and Poles, and I don’t even remember why that came up, but then after she said that, she said, “Yeah, we’re quite cosmopolitan.”"
sub-07,the_prisoner,7,145,"And she's driving him around, and they see like somebody on a bike, and they're going through all these roundabouts."
sub-07,the_prisoner,7,145,"And you see that they're in like this little village that has lots of funnily painted little shops, kinda like a little funhouse or toy thing."
sub-07,the_prisoner,7,"146, 147","Anyways, so they're, they're driving around, and eventually he like gets out, and he goes into this store."
sub-07,the_prisoner,7,147,"And he sees this guy there, this like kind of heavy-set guy who’s behind the counter."
sub-07,the_prisoner,7,148,And he walks to the counter and he tells the guy that he wants a map.
sub-07,the_prisoner,7,148,"And the guy asks him like, “What type of map do you want?”"
sub-07,the_prisoner,7,148,"And he’s like, “Whatever, just give me any map.”"
sub-07,the_prisoner,7,149,"And so the guy gives him a map, and the, the main character unfolds the map on the counter and looks at it and sees basically just some descriptions that say like, “Mountains,” “Village,” and just like a caricature of like a small town."
sub-07,the_prisoner,7,150,"And he tells the guy, “No, can you give me like a larger map?”"
sub-07,the_prisoner,7,150,"So he obviously wants to see more area, like what surrounds the village."
sub-07,the_prisoner,7,150,"And the guy asks him again, “Like what type of map? Like do you want it in color or something like that?”"
sub-07,the_prisoner,7,150,"And he says, “Whatever, like just give me a map. I just want it to be like a larger area.”"
sub-07,the_prisoner,7,150,"And he gives him the map, and he opens it, and it’s like a bigger, like a physically bigger map, like larger, but it doesn’t have more space around the town."
sub-07,the_prisoner,7,151,"And he's like, “You know, I wanna see more area.”"
sub-07,the_prisoner,7,-1,And I’m blanking on how this one ends.
sub-07,the_prisoner,7,151,"It might’ve ended just about there, but the guy behind the counter probably makes some comment, but I, I don’t remember what it is."
sub-07,the_rock,6,6000,"Ok, so the one before that was the one with the rock."
sub-07,the_rock,6,111,"So it starts off with this massive rock, who is kind of, the rock is like personified as, you know, a person."
sub-07,the_rock,6,111,"So the rock has eyes and a nose, and I don’t know if it has a mouth."
sub-07,the_rock,6,111,It definitely has eyes and a nose.
sub-07,the_rock,6,111,"And it’s a huge rock, and its looking out over like this quaint little stream, and there's like life around and this little green creature that pops up from the water and goes onto a rock and then pops back in."
sub-07,the_rock,6,112,"And the rock is like getting kind of tired, and so he closes his eyes to sleep."
sub-07,the_rock,6,"112, 113","And as he's sleeping, the earth undergoes massive changes, like, you know, the, the ice age and like dinosaur ages and so on."
sub-07,the_rock,6,113,"It kind of moves through many, many different stages, like millions and millions of years."
sub-07,the_rock,6,"113, 114","And then when the rock wakes back up, it’s been millions of years, and so he’s kind of worn away to a much smaller rock than he was initially."
sub-07,the_rock,6,114,"And he wakes up because there are, is somebody on his back who is chopping down this little tree that was like growing out of the rock."
sub-07,the_rock,6,114,"And then the rock is probably annoyed, because he’s been woken up out of his sleep."
sub-07,the_rock,6,114,"And then there's people that are next, that are by him, building away, making things."
sub-07,the_rock,6,115,"And then the rock like kind of, I think he gets up, but he moves away to somewhere else and goes to try to sleep somewhere else, like pulling up against a tree or something like that."
sub-07,the_rock,6,116,"And, but then he’s kind of taken away by other people and carted away where he’s made into a component of some kind of like mill or something that grounds I guess grains or something like that."
sub-07,the_rock,6,116,"I’m not sure what it is, like this thing rotates, and I think he grinds grains into flour or something like that."
sub-07,the_rock,6,116,"So he spends some of his life doing that, kind of rotating around and grinding things."
sub-07,the_rock,6,"117, 118","But then he’s taken away again, and now, the next time he’s fashioned into a cannonball."
sub-07,the_rock,6,119,He’s put into a cannon.
sub-07,the_rock,6,"119, 120",He’s shot off and lands somewhere.
sub-07,the_rock,6,120,"I don’t remember where, but the rest of the clip is basically about the evolution of this rock’s life."
sub-07,the_rock,6,121,"So after being in the cannonball, he ends up being like in a smaller rock."
sub-07,the_rock,6,121,And I think he ends up being on the beach at some point.
sub-07,the_rock,6,126,"Oh no, he’s, he’s kicked by some guy who is walking along the street, so now the rock is much smaller, and the guy kicks him."
sub-07,the_rock,6,126,He’s clearly frustrated at something.
sub-07,the_rock,6,127,"And the rock eventually goes through like this window, maybe after the guy kicks him, goes through this window, hits a guy who’s having like dinner with his significant other, and then like rolls out of the window."
sub-07,the_rock,6,130,"And eventually the rock ends up in a beach, and now he’s very, very tiny, in among the sand."
sub-07,the_rock,6,131,"And this, a machine comes and scoops up a bunch of sand, which it’s clear is going to be made into glass."
sub-07,the_rock,6,"132, 133, 134","And so this rock, now this tiny little rock is poured into fire, and fashioned into a glass lens or window of some sort that is put onto like a space shuttle that’s launched into space."
sub-07,the_rock,6,135,"And it goes through, you know, like I guess the atmosphere, and burns up and whatever."
sub-07,the_rock,6,135,"Eventually it hits another planet, and it hits another planet, the glass comes apart."
sub-07,the_rock,6,136,"And now this rock somehow, I’m not sure how, but it somehow trans-, it, it transforms into another enormous rock, exactly like the one that was in the beginning."
sub-07,the_rock,6,136,"And now again he’s in front of a stream, looking fondly on as it kind of rolls away in front of him."
sub-07,,-1,-1,"Ok, so let me make sure I described all of the ones in the last bit."
sub-07,,-1,-1,"The rock, the post-its, the black hole, the prisoner, the bus stop, okay."
sub-07,,-1,-1,So now to the first 25 minutes.
sub-07,,-1,-1,Let me see if I can remember those.
sub-07,catch_me_if_you_can,1,1000,"Alright, the first one was Catch Me If You Can."
sub-07,catch_me_if_you_can,1,1000,"I’ve never seen the movie, so I, I assume the game show part was part of the movie, but there was like two related segments."
sub-07,catch_me_if_you_can,1,6,"The first part was Catch Me If You Can game show with three contestants, who I guess are trying to compete for the part of somebody named Frank, Frank Williams Abagnale."
sub-07,catch_me_if_you_can,1,6,"The middle one is Leonardo DiCaprio, and I’m really bad with names, so I don’t know who the other two actors are."
sub-07,catch_me_if_you_can,1,6,"But they're introduced and then,"
sub-07,catch_me_if_you_can,1,7,"the, the voiceover says something about the background of this Frank Williams, I don’t know if it’s Williams, Frank something Abagnale character about how he impersonated a bunch of different jobs,"
sub-07,catch_me_if_you_can,1,7,"I think including something like a judge maybe or someone high up in court, maybe a surgeon, and something else, I don’t know, all, all pretty high positions."
sub-07,catch_me_if_you_can,1,7,"Anyways, the three people, who are all dressed as like navy captains or something like that, they move behind three different podiums, and they have a seat."
sub-07,catch_me_if_you_can,1,8,And this woman starts asking them questions.
sub-07,catch_me_if_you_can,1,8,"The first question she asked the first contestant is something like, “Why, why did you try to go for all those professions?”"
sub-07,catch_me_if_you_can,1,8,"And he’s like, “It comes down to dollars and cents."
sub-07,catch_me_if_you_can,1,8,"I guess those are the ways that I could make a lot of money."""
sub-07,catch_me_if_you_can,1,9,"And she goes to Leonardo DiCaprio’s character, and she says something about like, “How does it feel when you were finally caught?”"
sub-07,catch_me_if_you_can,1,9,"And then he, he mentions the name of the person who caught him, Carl, Carl Hambur, Hamley, something like that."
sub-07,catch_me_if_you_can,1,10,"And then it cuts away to Tom Hanks, who is this Carl something character, who is wearing like gray raincoat and has an umbrella, and he’s outside, and he's getting rained on."
sub-07,catch_me_if_you_can,1,10,"And he, I think, is trying to get into the prison to see this Frank character."
sub-07,catch_me_if_you_can,1,"11, 12, 13","And so he’s, he’s taken in by like a policeman, and he’s shown to the cell where, where Frank is hidden away."
sub-07,catch_me_if_you_can,1,"12, 13","We don’t see him at this point, but he’s shown like a little stool, and he’s told that he can sit there, that there is like this little doorway thing, which he isn’t allowed to pass anything through to the prisoner, but he can sit there and talk to him."
sub-07,catch_me_if_you_can,1,14,"And so the Tom Hanks character, Carl, I think, whatever, is sitting there,"
sub-07,catch_me_if_you_can,1,14,"and then he brings out like this book, and I think he starts reading him something about like different articles, something that is clearly, I guess, relevant to his case or how he's gonna be tried or something."
sub-07,catch_me_if_you_can,1,13,"And now we see Frank like holed up in his little cell, with long straggly hair, really, really sick, like coughing a lot."
sub-07,catch_me_if_you_can,1,13,His cough sounds really phlegmy and gross.
sub-07,catch_me_if_you_can,1,"13, 14","So he’s coughing a ton, and the Tom Hanks character is sitting out front trying to read him through like these different articles."
sub-07,catch_me_if_you_can,1,13,"And at some point it like starts to like drizzle on him or something, so he takes out his umbrella, pulls it up, puts it on top of him and starts reading."
sub-07,catch_me_if_you_can,1,15,"And his cough gets really, really, really bad."
sub-07,catch_me_if_you_can,1,15,"And then eventually, and by his I mean Frank’s cough gets really, really bad."
sub-07,catch_me_if_you_can,1,"16, 17","And then he like falls forward, and the Carl character says like, “Oh, somebody come, like we need help. We need to take him to a hospital."""
sub-07,catch_me_if_you_can,1,17,"""I feel like he’s really sick.”"
sub-07,catch_me_if_you_can,1,18,And so they pull Frank out of the little cell and take him to like the hospital ward.
sub-07,catch_me_if_you_can,1,19,And they're saying like they have to get him some treatment.
sub-07,catch_me_if_you_can,1,19,They have to get him to America or something like that.
sub-07,catch_me_if_you_can,1,19,"And then the Carl character is saying something about how he worked really hard to get him here, and they can't lose him."
sub-07,catch_me_if_you_can,1,19,And they're kind of conversing a while with the curtains pulled around Frank.
sub-07,catch_me_if_you_can,1,20,"And then the next time they check behind the curtains, he’s gone."
sub-07,catch_me_if_you_can,1,21,"And then the next scene we see is like Frank who is like coughing, still like coughing his lungs out, running very slowly, kind of stumbling through, trying to escape, going through like the prison with all of the other prisoners yelling like, “Frank, Frank, Frank."""
sub-07,catch_me_if_you_can,1,21,"And he's like stumbling, trying to get away."
sub-07,catch_me_if_you_can,1,23,"But then all of the, the other policeman and the detective or whoever, they are coming up behind him, obviously gonna catch up with him."
sub-07,catch_me_if_you_can,1,23,"But he's still trying to get away, and then he like drops down to the floor and tries to crawl away really slowly."
sub-07,catch_me_if_you_can,1,"24, 25","But eventually they get to him, and he falls backward."
sub-07,catch_me_if_you_can,1,-1,"I don’t remember anything after that, so I think it must’ve ended then."
sub-07,,-1,-1,Ok.
sub-07,the_record,2,2000,"The next one, I think it was The Record."
sub-07,the_record,2,28,"So it starts with this, this was a cartoon, and starts with like this redheaded girl who’s in her little like apartment,"
sub-07,the_record,2,"28, 29","and she has a box of pizza, and she opens it, and she gets out a slice, and then she’s gonna start to eat, but she gets some mail."
sub-07,the_record,2,"30, 31","And so she goes to her door, and opens the door and gets her mail out, then sits back on her seat and pulls out a record."
sub-07,the_record,2,32,"It’s called A Single Life, and she puts the record on the record player and starts to play it."
sub-07,the_record,2,33,"And then she's listening, she’s listening, and it kind of skips a little bit to a different song."
sub-07,the_record,2,34,"And she notices that when it does that, her pizza kind of like disappears."
sub-07,the_record,2,34,"Well it doesn’t disappear, but the slice in her hand goes down to like close to the crust."
sub-07,the_record,2,35,"And then when she adjusts the, like the needle on the record player, it kind of grows back."
