sub-id,movie_name,movie_num,scene,text
sub-07,the_record,2,35,"And so she messes around with this for a bit, and she notices that she could make the bit of the pizza go up and then disappear again and come back up and disappear again."
sub-07,the_record,2,35,"And so she starts messing around with the record player a bit more, and notices that she could make the entire pizza including like the bit in the box disappear and then come back, and disappear and then come back."
sub-07,the_record,2,35,So she skips around a little bit more.
sub-07,the_record,2,36,"And then suddenly when she skips, she’s now in a completely different apartment."
sub-07,the_record,2,36,"It’s like fancier and like all sleek and posh, and she's like well dressed, and she has a baby."
sub-07,the_record,2,36,"Well, I mean, she’s pregnant, she doesn’t have a baby, but she's pregnant."
sub-07,the_record,2,36,"And then she skips around with the needle again, but the, the record player’s always there in front of her."
sub-07,the_record,2,37,"So she, she skips again, and then she’s no longer pregnant."
sub-07,the_record,2,37,"And then she’s pregnant again, she's no longer pregnant."
sub-07,the_record,2,37,"And then she decided to skip ahead until she already has a baby in her arms, and she's no longer pregnant."
sub-07,the_record,2,37,"But then like the baby starts wailing and crying, and she's like, “I don’t wanna have anymore of this.”"
sub-07,the_record,2,38,"And so she skips again, and then she's like a little child, little like two-year-old or a toddler."
sub-07,the_record,2,38,"Again, the record player is in front of her, but she's like in, you know, a child’s room."
sub-07,the_record,2,38,"And she's probably thinking like, “No, I don’t want this either,” and so she tries to skip ahead to the record again, but her little arms can barely reach it, but eventually she gets it."
sub-07,the_record,2,39,"And she forces the record to skip again, and this time she’s an old lady, old lady in a wheelchair, and she’s probably thinking, “No, I don’t want this either.”"
sub-07,the_record,2,39,And so she tries to move forward to make the record like kinda skip again to like a different track.
sub-07,the_record,2,39,"But the record keeps jumping on its own, and every time it does that, it kind of moves her back in time, so she moves forward in her armchair, in her wheelchair, but then is forced to jump back in time."
sub-07,the_record,2,39,"She does that a few bits, and it’s like she’s stuck in this loop."
sub-07,the_record,2,40,"But eventually she gets it to, to skip ahead to like another track."
sub-07,the_record,2,40,"And this time again she's an old lady in a walker,"
sub-07,the_record,2,-1,and I don’t remember what happens from here.
sub-07,the_record,2,40,"I feel like she might’ve fallen, but I'm not 100% sure."
sub-07,the_record,2,2000,That’s all I can remember from that one.
sub-07,,-1,-1,Ok.
sub-07,the_boyfriend,3,3000,"The next one, ok, so I think it’s the boyfriend one."
sub-07,the_boyfriend,3,43,"So it’s this woman who’s sitting at a table across from her, I guess it’s her husband not her boyfriend, although I think the clip was called The Boyfriend, because he has the wedding ring."
sub-07,the_boyfriend,3,43,"Anyway, they're sitting across from each other, and they're having dinner."
sub-07,the_boyfriend,3,44,"And she asks him if he wants a glass of wine, and he's like, something like, “No, I’m on call tomorrow,” or “I’m on call,” or something like that, so he can't have wine."
sub-07,the_boyfriend,3,45,"So she pours herself a glass of wine, and she downs the whole thing really quickly while looking at him and then pours herself some more wine."
sub-07,the_boyfriend,3,45,"And then he's eating kind of methodically, kind of robotically, and she's looking at him."
sub-07,the_boyfriend,3,46,"And then I think she asks him something about how he likes the dinner or something, and he's like, “It’s really good. The asparagus is quite tender.”"
sub-07,the_boyfriend,3,46,"And she's like, “Yeah, they say it’s an aphrodisiac,” and he's like, “Who’s they?”"
sub-07,the_boyfriend,3,46,"And she's like, “I don’t know, just something they say.”"
sub-07,the_boyfriend,3,46,"Anyways, they are talking a little bit."
sub-07,the_boyfriend,3,46,"I don’t remember what else they talk about specifically, but she's obviously getting really annoyed with him."
sub-07,the_boyfriend,3,47,"She's like, you know, “Why can't you just like have a drink?"""
sub-07,the_boyfriend,3,47,"""It’s not like you're a surgeon, you're like a computer analyst, or something like that."""
sub-07,the_boyfriend,3,47,"""Just have a drink.”"
sub-07,the_boyfriend,3,47,"And then she throws some, like part of her wine on him."
sub-07,the_boyfriend,3,48,"And then he takes out a cigarette, puts it in his mouth, lights it."
sub-07,the_boyfriend,3,48,"And she's like, “Oh no, you're not smoking in my house.”"
sub-07,the_boyfriend,3,48,"And I guess she somehow puts out the cigarette, I don’t remember how."
sub-07,the_boyfriend,3,48,"But then he puts another in, and he lights it."
sub-07,the_boyfriend,3,48,"And she's getting like really, really annoyed."
sub-07,the_boyfriend,3,"50, 51","And I don’t remember the next few details, but eventually she like, she goes up to him, and we find that he has like a switch in the back of his neck, which she turns off, and he like, you know, stops functioning, because apparently he’s like a robot."
sub-07,the_boyfriend,3,52,"And she thinks, probably, she probably thinks to herself, “Well I can do better than this.”"
sub-07,the_boyfriend,3,53,"And so she goes to her computer and she logs on to this website where you can buy your robotic boyfriend, husband."
sub-07,the_boyfriend,3,53,"So she sits down, and she's like browsing all the better options that she could get."
sub-07,the_boyfriend,3,53,"So she finds like a later model that is probably better, and this guy who is like a rock climber or something like that."
sub-07,the_boyfriend,3,54,"And she calls up and says that she's like not happy with her current model, and she’d kind of like an upgrade."
sub-07,the_boyfriend,3,54,"And they're like, “What’s your complaint?”"
sub-07,the_boyfriend,3,54,"And she's like, “You know, he's like lacking ambition,” and they're like, “Yeah we get this complaint a lot with that series."""
sub-07,the_boyfriend,3,54,"""What can I offer you? Like some other, like higher-end model?”"
sub-07,the_boyfriend,3,54,"And she's like, “Yeah, I think so.”"
sub-07,the_boyfriend,3,55,"And they're like, “What would you like?” and she’s like, “I don’t know, maybe a rock climber.”"
sub-07,the_boyfriend,3,55,"And then she like clicks through, and she’s like, she sees like a masseuse, and she's like, “No wait, maybe a masseuse or a rock-climbing masseuse.”"
sub-07,the_boyfriend,3,"56, 57","And then she gets a delivery later of her new robotic boyfriend, husband person."
sub-07,the_boyfriend,3,"58, 59, 60","And then they're taking away her old one, but she, she takes the wedding ring off the old one and puts it on the new one."
sub-07,the_boyfriend,3,61,"And the new one is like this all outdoorsy type guy, who is now carted in and put in the same seat where her old robotic husband boyfriend person was."
sub-07,the_boyfriend,3,61,"And she sits down across from him on the table, after she turns on the switch of course."
sub-07,the_boyfriend,3,61,"And then he's kind of slow getting started, a little bit methodical."
sub-07,the_boyfriend,3,61,"But then he like you know, comes to life."
sub-07,the_boyfriend,3,62,And she asks him if he wants a drink.
sub-07,the_boyfriend,3,62,"And he's like, “No, I can't. I have a, I have a climb tomorrow."""
sub-07,the_boyfriend,3,62,"And she's probably thinking like, “Oh no, here we go again.”"
sub-07,the_boyfriend,3,63,"Then he takes a bite of his asparagus, and he's like, “Mmm, this is tender.”"
sub-07,the_boyfriend,3,63,"And then she's probably thinking at this point like, “I can't believe he's having this, we’re having this conversation again.”"
sub-07,the_boyfriend,3,63,"But then he looks up at her, and he's like, “They say its an aphrodisiac.”"
sub-07,the_boyfriend,3,63,"And she's like happy now, smiling a little bit and says, “Who’s they?”"
sub-07,the_boyfriend,3,63,"And he's like, “I don’t know. It’s just something they say."""
sub-07,the_boyfriend,3,"64, 65","And then he gets up and goes around the long table to her and stands behind her, and is like, “How was your day?”"
sub-07,the_boyfriend,3,65,"And she's like, “Oh,” ‘cause she’s like obviously happy to be having this conversation, pleased with her new purchase."
sub-07,the_boyfriend,3,65,"And she's like, “Oh, this morning, I was like, I went into the shop to get some stuff to get ready for tonight.”"
sub-07,the_boyfriend,3,49,"Oh, I forgot to mention it’s her anniversary, that’s why they were having this dinner."
sub-07,the_boyfriend,3,49,"And I think part of the earlier complaint was something about like, “Oh, it’s our anniversary. Can't you just have a drink?”"
sub-07,the_boyfriend,3,65,"Anyway, they're back to the current moment."
sub-07,the_boyfriend,3,65,"She’s like, yeah, she went shopping to get stuff for tonight."
sub-07,the_boyfriend,3,65,And he's like massaging her shoulders as she's talking.
sub-07,the_boyfriend,3,65,And she's clearly very pleased with the massage.
sub-07,the_boyfriend,3,65,"He keeps on massaging her, and she's talking, and then his hands get closer and closer to her neck."
sub-07,the_boyfriend,3,66,And then we find that he switches her off.
sub-07,the_boyfriend,3,66,"So her face drops forward, and then the camera zooms around behind her, and we see that she also has a switch at the back of her neck."
sub-07,the_boyfriend,3,67,"And dude’s apparently very smart, because he turned her off to shut her up, and then he goes forward and sits himself down on the armchair in front of the TV, turns it on, and starts watching."
sub-07,the_shoe,4,4000,"Alright, the next one I think was The Shoe."
sub-07,the_shoe,4,69,"So it starts off with this guy’s shoe, that’s what we see."
sub-07,the_shoe,4,69,"Some, the text in the top left says something about like where, where it began, or where it ends up."
sub-07,the_shoe,4,69,"I think it’s where it began, I can’t remember."
sub-07,the_shoe,4,70,But the guy’s there.
sub-07,the_shoe,4,70,"The guy’s shoe, he’s leaning against a car."
sub-07,the_shoe,4,70,"And he's like super tough, and so he's drinking milk."
sub-07,the_shoe,4,70,So he's opening this carton of milk and drinking the milk while propped up against the car.
sub-07,the_shoe,4,"72, 73","And then this guy comes out, and then apparently the dude who’s drinking the milk, it’s not his car, it’s somebody else’s car, and he chases him away, and so the guy who’s drinking the milk walks away from the car, still drinking the milk."
sub-07,the_shoe,4,"71, 74",At some point he noticed this woman who was across the street and decided that he wanted to impress her or something.
sub-07,the_shoe,4,"73, 74","So he's walking along, looking at her, kind of stumbles a bit."
sub-07,the_shoe,4,74,"And he looks towards her, and then she stumbles a bit, kind of like making fun of him."
sub-07,the_shoe,4,76,"And then he does a few more things that she starts to copy, like I think he starts swinging his hands or something like that."
sub-07,the_shoe,4,76,And then she starts swinging her hands and looking over at him.
sub-07,the_shoe,4,76,"And then she starts like waving her arms behind her back and like bending over, and then he waves his arms behind his back and in front of him and bends over."
sub-07,the_shoe,4,76,And so they keep walking along this street.
sub-07,the_shoe,4,76,"Each one is copying what the other one’s doing, clearly having fun and laughing."
sub-07,the_shoe,4,77,"And then they get to an intersection, and she stops suddenly."
sub-07,the_shoe,4,77,"And she clearly wants him to stop, because otherwise he’s gonna walk right in front of this truck."
sub-07,the_shoe,4,77,"And so she stops, hoping that he’ll stop, and then she like raises her arms up, acts surprised and shocked and trying to like get him to imitate her, which would mean that he’d stop."
sub-07,the_shoe,4,77,"But he is having so much fun that he doesn’t stop, he just keeps walking forward."
sub-07,the_shoe,4,78,"He keeps walking into the intersection, is hit by a truck, shoe flies off."
sub-07,the_shoe,4,80,"You see the shoe land in the street, and the camera pans a little bit, and then we see a woman’s shoe that’s next to it."
sub-07,keith_reynolds,5,5000,"Alright, the last one, Keith Reynolds."
sub-07,keith_reynolds,5,"82, 84","So, a little stick figure in a car drives up to a building, gets out of the car, and gets its hat and its briefcase."
sub-07,keith_reynolds,5,85,"It’s Keith Reynolds, and Keith Reynolds is really excited, because he is looking forward to his promotion that day."
sub-07,keith_reynolds,5,"85, 86","He is the most junior type of business analyst, and he's like really, really waiting for this promotion that he knows is gonna happen today."
sub-07,keith_reynolds,5,85,"So he walks in, and we see kind of a cut through of his building."
sub-07,keith_reynolds,5,85,So we see the many different floors of the office building that he’s working in and the people on the different floors.
sub-07,keith_reynolds,5,86,"And he gets into his elevator, and he, he goes up, and he gets out, and there's this woman, who’s a pink stick figure, bending over and like putting some stuff in or taking some stuff out of a cabinet, or something like that."
sub-07,keith_reynolds,5,86,"Her name’s Sara, and Keith wants to impress Sara."
sub-07,keith_reynolds,5,86,"So he wants to get this promotion, and he wants to impress this girl."
sub-07,keith_reynolds,5,86,"And so he walks in, and he always tries to get her to talk to him."
sub-07,keith_reynolds,5,86,"And he tries to make her know that she should spend the rest of his life, her life with him."
sub-07,keith_reynolds,5,87,And the way he does that is by always offering her coffee.
sub-07,keith_reynolds,5,87,And so he offers her coffee as he always does.
sub-07,keith_reynolds,5,87,"She never wants any, but he offers it anyway."
sub-07,keith_reynolds,5,87,She takes it.
sub-07,keith_reynolds,5,87,"We see her take the coffee, dump it out of the window."
sub-07,keith_reynolds,5,87,"Unfortunately, the hot coffee"
