movie,scene,starttime,endtime,startsec_adj,endsec_adj,startTR,endTR,text
10,"211,212,213",19:08,19:14,1089.927,1095.927,728,731,"She shoots the magician guy and the magician guy shoots her and phone guy has now become a dog barking, he's walking around on all fours."
10,214,19:14,19:23,1095.927,1104.927,732,737,"Out of the trunk comes another girl, who's also a dog, I guess the one the first lady was asking about."
10,215,19:23,19:27,1104.927,1108.927,738,739,So now they're both dogs and they're acting like dogs and they're like sniffing each other and barking at each other.
10,216,19:28,19:33,1109.927,1114.927,741,743,And they walk off together under the bridge and that's the end of that one.
-1,-1,19:35,19:37,1116.927,1118.927,746,746,I am missing a lot of them.
7,7000,19:40,19:46,1121.927,1127.927,749,752,So there's one called the Village or the Prisoner or something like that.
7,7000,19:48,19:53,1129.927,1134.927,754,757,"It looks like it's from, it's a Wizard of Oz style cinematography, so it's an older movie I think."
7,138,19:55,19:58,1136.927,1139.927,759,760,And there's a guy and he's sort of confused about where he is.
7,138,19:58,20:06,1139.927,1147.927,761,765,"He's at a cafe and he's trying to ask the lady, the cafe lady, what village he's in and where the village is, and she's totally confused."
7,"138,141",20:08,20:16,1149.927,1157.927,768,772,"But she directs him to a place where he can make a phone call, and he picks up the phone, and it's sort of a weird looking phone, it's not a payphone, it's a cordless phone, sitting there."
7,141,20:18,20:24,1159.927,1165.927,774,777,"He talks to the, there's an operator on the other side of the phone, he wants to know where he is and she won't tell him, she just wants to know what is his number."
7,141,20:25,20:29,1166.927,1170.927,779,781,"He says he doesn't have a number and she says no number, no phone call, hangs up on him."
7,143,20:31,20:39,1172.927,1180.927,783,787,Then he finds some kind of a board with buttons on it and it's got a map of the village that says the village and he pushes a button for a taxi and the taxi lady shows up.
7,144,20:39,20:50,1180.927,1191.927,788,795,"He's trying to get the taxi lady to tell him where he is, or can she take him out of the village, and she says no, it's a local taxi only and so he says take me as far as you can and gets into the taxi and they go."
7,145,20:52,20:54,1193.927,1195.927,797,797,Then she goes as far as she can which is not that far.
7,147,20:55,21:04,1196.927,1205.927,799,804,"And then, he goes into a shop, and there's a shopkeeper there and he's talking to the shopkeeper, the shopkeeper's talking in Italian or something to a lady and they switch to English as he walks in."
7,148,21:06,21:08,1207.927,1209.927,806,807,And then he walks into the shop and he asks the shopkeeper for a map.
7,148,21:09,21:13,1210.927,1214.927,808,810,"And the shop guy asks him if it's a color or black and white map he wants, and he doesn't care, he just wants a map."
7,149,21:14,21:17,1215.927,1218.927,812,813,So he gets a map and the map is just a map of one village.
7,149,21:17,21:24,1218.927,1225.927,814,817,"It's a very small village, it's only got a couple buildings in it and around it it's just really vague, it just says the mountains, the mountains, the sea, there's no details."
7,150,21:24,21:36,1225.927,1237.927,818,825,"So he asks for a larger map and after a bunch of fuss the guy gets him out a larger map which is colored this time, and the larger map doesn't show any bigger area, it's just a physically larger map but exactly the same thing."
7,7000,21:38,21:39,1239.927,1240.927,828,828,And I think that's the end of that one.
7,7000,21:39,21:47,1240.927,1248.927,828,833,I guess it's the beginning of some movie where he's trapped in this you know weird Twilight Zone sort of a situation.
-1,-1,21:52,21:53,1253.927,1254.927,837,837,I know I'm forgetting a lot of these.
-1,-1,21:56,21:57,1257.927,1258.927,840,840,Trying to remember more.
-1,-1,22:30,22:34,1291.927,1295.927,862,864,"There’s catch me if you can, there’s that Claymation one, the pizza."
-1,-1,22:39,22:40,1300.927,1301.927,868,868,What came after that?
-1,-1,22:48,22:51,1309.927,1312.927,874,875,"Uh, I don't know, I think I only remembered about half of them."
-2,-2,23:27,23:30,1348.927,1351.927,900,901,"I don't know, I'm not remembering anymore, I guess I'm done."
0,0,23:30,23:32,1351.927,1353.927,902,903,I guess I'm ready to see the titles.
