movie_num,seg_num,seg_start_time,subseg_num,subseg_start_time,text
9,178,15.18,2,15.24,The man has made an entire portrait of the two of them together made out of sticky notes using yellow for skin and blue for hair and shadows. He is putting the final touches on it.
9,179,15.32,1,15.32,"The man notices her, and is surprised that she is there, staring at her."
9,180,15.4,1,15.4,"The camera pans on the woman, who is about to tear up, and then she smiles. It then cuts to black."
10,181,15.48,1,15.48,Black screen
10,181,15.48,2,15.53,"White text fades in and expands then fades out: ""BUS STOP"""
10,182,15.56,1,15.56,A shot of the sun with some music being played from an off-screen device
10,182,15.56,2,16.01,Shot of an empty street in a suburban-rural area with a few shops
10,182,15.56,3,16.05,"We see a tired, dazed man in a red shirt and brown pants holding a bag with ice cream in it playing music in his headphones at a bus stop."
10,183,16.2,1,16.200000000000003,A black van drives in at the street corner to the man's right. He looks over and a woman gets out of the driver's seat and runs around the back of the van
10,183,16.2,2,16.3,The man stares as the woman goes the pay phone next the back of the van
10,184,16.38,1,16.380000000000003,"The man looks at the woman as she clicks the phone but then bangs the phone on the hook, all while the man is still watching."
10,185,16.46,1,16.46,She looks around and then spots the man watching. Her van starts to roll.
10,185,16.46,2,16.51,"She comes towards him as he looks away, the van continues rolling. She says ""Hey!"""
10,186,16.55,1,16.55,"The woman says ""Excuse me"" and then asks for the man's phone"
10,186,16.55,2,17.01,The woman asks for the phone again and the man hands her his phone. She assures him she won't take it.
10,187,17.1,1,17.1,"The woman calls the person she needs to call; she says ""I'm here."" She paces around to the man's right."
10,187,17.1,2,17.17,The woman paces around and the man looks tired and waiting for her to be finished.
10,187,17.1,3,17.240000000000002,The woman rants on the phone while the man looks incredibly exhausted.
10,188,17.3,1,17.3,"The woman yells on the phone that she will go to the police, and the person on the phone hangs up."
10,189,17.37,1,17.37,The woman throws the phone onto the ground and the man looks shocked then goes up to her. The woman cries.
10,190,17.45,1,17.450000000000003,The woman cries and the man says to her that his phone is broken.
10,190,17.45,2,17.51,The man asks for 60 dollars for a new phone.
10,191,17.58,1,17.580000000000002,"The woman says that ""he's here"" and the man asks ""are you ok?"""
10,192,18.0,1,18.0,A man drives in another car to some classical trumpet music to the same area.
10,192,18.0,2,18.09,The man stops the car and sits in the car while the music plays.
10,193,18.13,1,18.130000000000003,"The camera revolves around the woman and the man asks ""Who's that?"""
10,194,18.21,1,18.21,"The woman walks towards the other car, and the man asks for money again for the phone."
10,194,18.21,2,18.290000000000003,The man is following the woman to the car with the man who came.
10,195,18.36,1,18.360000000000003,The man stops the music as he sees the woman and gets out of the car.
10,196,18.42,1,18.42,The woman walks up to the man who rests on the hood of his car. The woman threatens the man as she walks up.
10,197,18.5,1,18.5,The woman curses at the man who asks what her problem was.
10,197,18.5,2,18.55,"The man says that the woman will start behaving and that everything will be ok. The woman asks ""where is she?"""
10,198,19.02,1,19.020000000000003,"The 2nd man asks who the first man is, and the woman says that he's a friend. The woman runs past her. The 2nd man walks up to the 1st man while the first man is trying to explain the situation."
10,198,19.02,2,19.130000000000003,The 2nd man asks the first man if he knows who the first man is. The woman runs in between and says no one knows who he is. The 2nd man asks the woman if she told the 1st man who he is.
10,199,19.21,1,19.21,"The 2nd man backs up the woman and the 1st man remembers that the second man is ""Aldini The Great"" and he does magic tricks at the casino. Aldini bows."
10,200,19.28,1,19.28,"The 1st man recognizes the woman as his assistant, but the woman pulls a gun on both of the men. Aldini says to take it easy."
10,201,19.35,1,19.35,"Aldini does a magic trick and pulls out a gun of his own, which he shows everyone and that he stole it from a Professor Physique."
10,202,19.44,1,18.44,The woman fires a shot into the air and points the gun at Aldini and Aldini points a gun back.
10,203,19.51,1,19.51,A squeal can be heard from inside the car as the camera pans into it
10,204,19.58,1,19.580000000000002,Aldini assures that whoever is in the car is going to be ok.
10,205,20.11,1,20.040000000000003,"Aldini stops the 1st man who is walking away, and says that he has something to show him."
10,206,20.14,1,20.14,Aldini hypnotizes the man by showing him an artifact.
10,206,20.14,2,20.24,Aldini's voice gets deeper and deeper as the man is putting a spell on him.
10,207,20.28,1,20.28,Aldini's is still giving the spell but the woman opens the trunk and is shocked by what she sees.
10,208,20.36,1,20.360000000000003,"The man is continuing to be hypnotized, dropping the ice cream and his eyes going to the back of his head."
10,208,20.36,2,20.470000000000002,"The 1st man falls to the ground, dropping everything, including his ice cream."
10,208,20.36,3,20.580000000000002,The 1st man is on the ground and everything is slow to him.
10,209,21.03,1,21.03,The 1st man is acting like a dog on the ground as he wakes up after being hypnotized.
10,210,21.09,1,21.09,Aldini thinks he got the spell wrong so he looks at the spell written on a small piece of paper.
10,211,21.17,1,21.17,The woman walks up to Aldini with the gun out.
10,211,21.17,2,21.21,Aldini looks up as the 1st man is eating ice cream off the ground after being spilled. Gun shots fire.
10,212,21.28,1,21.28,"The magician is on the ground, dying and blood-soaked, and he shoots back and then proceeds to die."
10,213,21.32,1,21.32,The 1st proceed to eat the ice cream like before.
10,213,21.32,2,21.360000000000003,A wide shot shows both the assistant and Aldini are dead on the ground. The man barks like a dog at some dogs off screen.
10,213,21.32,3,21.470000000000002,"The man crawls away towards the car, barking at dogs who bark at him as he makes his way to the car."
10,213,21.32,4,21.580000000000002,The man stops and barks at something off screen.
10,214,22.04,1,22.040000000000003,The camera pans over quickly to reveal that it is another woman who is in a white dress barking like a dog at her as well.
10,215,22.12,1,22.12,"They crawl up to each other and smell each other, the first man barking twice then the woman barking back."
10,215,22.12,2,22.21,"They face each other again but at opposite sides from before, barking at each other still, as the woman barks as the man crawls away."
10,215,22.12,3,22.32,The first man crawls away but the woman barks at him and the man falls on his back but then gets back up and crawls with the woman past the magician's car.
10,216,22.37,1,22.37,"The man and woman still crawl away past the black car, barking at each other."
10,216,22.37,2,22.48,The screen fades to black
